[
  {
    "abbr": "BOR",
    "name": "Board of Review for Assessments",
    "category": "Finance & Governance",
    "description": "",
    "color": "#6a5038",
    "slug": "bor",
    "legalClassification": "Quasi-Judicial Commissions",
    "hasRecordings": false,
    "bodyType": "appointed",
    "boardEmail": null,
    "subscribeEnabled": false,
    "jointWith": null,
    "members": [
      {
        "position": 1,
        "firstName": "James",
        "lastName": "Lippincott",
        "role": "Member",
        "positionRequirement": "",
        "termStart": "2024-02-01",
        "termEnd": "2027-01-31",
        "residency": "Resident",
        "isVacant": false
      },
      {
        "position": 2,
        "firstName": "Richard",
        "lastName": "Skalski",
        "role": "Alternate",
        "positionRequirement": "",
        "termStart": "2024-02-01",
        "termEnd": "2027-01-31",
        "residency": "Resident",
        "isVacant": false
      },
      {
        "position": 3,
        "firstName": "Linda",
        "lastName": "Servis",
        "role": "Member",
        "positionRequirement": "",
        "termStart": "2025-02-01",
        "termEnd": "2028-01-31",
        "residency": "Resident",
        "isVacant": false
      },
      {
        "position": 4,
        "firstName": "H. Charles",
        "lastName": "Kiplinger",
        "role": "Member",
        "positionRequirement": "",
        "termStart": "2025-02-01",
        "termEnd": "2028-01-31",
        "residency": "Resident",
        "isVacant": false
      },
      {
        "position": 5,
        "firstName": "Clyde",
        "lastName": "Robinson",
        "role": "Member",
        "positionRequirement": "",
        "termStart": "2024-02-01",
        "termEnd": "2027-01-31",
        "residency": "Resident",
        "isVacant": false
      },
      {
        "position": 6,
        "firstName": "Michael",
        "lastName": "Anderson",
        "role": "Member",
        "positionRequirement": "",
        "termStart": "2025-02-01",
        "termEnd": "2028-01-31",
        "residency": "Resident",
        "isVacant": false
      },
      {
        "position": 7,
        "firstName": "William",
        "lastName": "Gladstone III",
        "role": "Member",
        "positionRequirement": "",
        "termStart": "2025-02-01",
        "termEnd": "2028-01-31",
        "residency": "Resident",
        "isVacant": false
      },
      {
        "position": 8,
        "firstName": "Donna",
        "lastName": "Keller",
        "role": "Member",
        "positionRequirement": "",
        "termStart": "2023-02-06",
        "termEnd": "2026-01-31",
        "residency": "Resident",
        "isVacant": false
      },
      {
        "position": 9,
        "firstName": "",
        "lastName": "",
        "role": "Member",
        "positionRequirement": "",
        "termStart": null,
        "termEnd": null,
        "residency": "Resident",
        "isVacant": true
      }
    ]
  },
  {
    "abbr": "BRA",
    "name": "Brownfield Redevelopment Authority Board",
    "category": "Economic Development",
    "maxMembers": 13,
    "description": "",
    "color": "#5a6a2a",
    "slug": "bra",
    "legalClassification": "Authorities",
    "hasRecordings": false,
    "bodyType": "appointed",
    "boardEmail": null,
    "subscribeEnabled": false,
    "jointWith": "EDC",
    "members": [
      {
        "position": 1,
        "firstName": "Kyle",
        "lastName": "Gulau",
        "role": "Chair",
        "positionRequirement": "",
        "termStart": "2025-04-01",
        "termEnd": "2031-03-31",
        "residency": "Resident",
        "isVacant": false
      },
      {
        "position": 2,
        "firstName": "Scott",
        "lastName": "Petersen",
        "role": "Member",
        "positionRequirement": "",
        "termStart": "2025-04-01",
        "termEnd": "2031-03-31",
        "residency": "Non-Resident",
        "isVacant": false
      },
      {
        "position": 3,
        "firstName": "Jason",
        "lastName": "Novotny",
        "role": "Member",
        "positionRequirement": "",
        "termStart": "2025-04-01",
        "termEnd": "2031-03-31",
        "residency": "Non-Resident",
        "isVacant": false
      },
      {
        "position": 4,
        "firstName": "Lucas",
        "lastName": "Middleton",
        "role": "Member",
        "positionRequirement": "",
        "termStart": "2020-07-06",
        "termEnd": "2026-03-31",
        "residency": "Resident",
        "isVacant": false
      },
      {
        "position": 5,
        "firstName": "Rachel",
        "lastName": "Bair",
        "role": "Vice Chair",
        "positionRequirement": "",
        "termStart": "2025-04-01",
        "termEnd": "2031-03-31",
        "residency": "Resident",
        "isVacant": false
      },
      {
        "position": 6,
        "firstName": "Sharon",
        "lastName": "Ferraro",
        "role": "Member",
        "positionRequirement": "",
        "termStart": "2022-08-15",
        "termEnd": "2028-03-31",
        "residency": "Resident",
        "isVacant": false
      },
      {
        "position": 7,
        "firstName": "Michael",
        "lastName": "Gurnee",
        "role": "Member",
        "positionRequirement": "",
        "termStart": "2022-08-15",
        "termEnd": "2026-03-31",
        "residency": "Resident",
        "isVacant": false
      },
      {
        "position": 8,
        "firstName": "Andrew",
        "lastName": "Schipper",
        "role": "Secretary/Treasurer",
        "positionRequirement": "",
        "termStart": "2022-08-15",
        "termEnd": "2028-03-31",
        "residency": "Non-Resident",
        "isVacant": false
      },
      {
        "position": 9,
        "firstName": "Drew",
        "lastName": "Duncan",
        "role": "Member",
        "positionRequirement": "City Commission Representative",
        "termStart": "2025-11-17",
        "termEnd": "2029-11-19",
        "residency": "",
        "isVacant": false
      },
      {
        "position": 10,
        "firstName": "T.J.",
        "lastName": "Ward",
        "role": "Member",
        "positionRequirement": "",
        "termStart": "2025-05-12",
        "termEnd": "2028-03-31",
        "residency": "Non-Resident",
        "isVacant": false
      },
      {
        "position": 11,
        "firstName": "Eddie",
        "lastName": "Warr",
        "role": "Member",
        "positionRequirement": "",
        "termStart": "2025-04-01",
        "termEnd": "2031-03-31",
        "residency": "Non-Resident",
        "isVacant": false
      }
    ]
  },
  {
    "abbr": "BBA",
    "name": "Building Board of Appeals",
    "category": "Land Use & Planning",
    "description": "",
    "color": "#3a5e7a",
    "slug": "bba",
    "legalClassification": "Quasi-Judicial Commissions",
    "hasRecordings": false,
    "bodyType": "appointed",
    "boardEmail": null,
    "subscribeEnabled": false,
    "jointWith": null,
    "members": [
      {
        "position": 1,
        "firstName": "Khari",
        "lastName": "Worthy",
        "role": "Member",
        "positionRequirement": "Historic District Property Owner",
        "termStart": "2021-07-19",
        "termEnd": "2024-03-31",
        "residency": "Resident",
        "isVacant": false
      },
      {
        "position": 2,
        "firstName": "Benjamin",
        "lastName": "Bierlein",
        "role": "Member",
        "positionRequirement": "",
        "termStart": "2022-06-06",
        "termEnd": "2025-03-31",
        "residency": "Resident",
        "isVacant": false
      },
      {
        "position": 3,
        "firstName": "Jillian",
        "lastName": "Hocking",
        "role": "Member",
        "positionRequirement": "Residential Facilities Management",
        "termStart": "2022-06-06",
        "termEnd": "2025-03-31",
        "residency": "Non-Resident",
        "isVacant": false
      },
      {
        "position": 4,
        "firstName": "Ryan",
        "lastName": "Long",
        "role": "Member",
        "positionRequirement": "Residential Construction Experience",
        "termStart": "2022-06-06",
        "termEnd": "2024-03-31",
        "residency": "Resident",
        "isVacant": false
      },
      {
        "position": 5,
        "firstName": "Matthew",
        "lastName": "Maycroft",
        "role": "Member",
        "positionRequirement": "Construction Experience",
        "termStart": "2022-06-06",
        "termEnd": "2024-03-31",
        "residency": "Resident",
        "isVacant": false
      },
      {
        "position": 6,
        "firstName": "Andrew",
        "lastName": "Van Lente",
        "role": "Member",
        "positionRequirement": "Residential/commercial property leasing or maintenance experience",
        "termStart": "2022-06-06",
        "termEnd": "2025-03-31",
        "residency": "Resident",
        "isVacant": false
      },
      {
        "position": 7,
        "firstName": "Richard",
        "lastName": "Emig",
        "role": "Member",
        "positionRequirement": "",
        "termStart": "2025-12-01",
        "termEnd": "2027-03-31",
        "residency": "Resident",
        "isVacant": false
      },
      {
        "position": 8,
        "firstName": "Scott",
        "lastName": "Brooks",
        "role": "Ex-Officio Member",
        "positionRequirement": "",
        "termStart": "2020-11-26",
        "termEnd": "2100-01-01",
        "residency": "",
        "isVacant": false
      },
      {
        "position": 9,
        "firstName": "Luis",
        "lastName": "Pena",
        "role": "Ex-Officio Member",
        "positionRequirement": "",
        "termStart": "2022-02-11",
        "termEnd": "2100-01-01",
        "residency": "",
        "isVacant": false
      }
    ]
  },
  {
    "abbr": "CPSRAB",
    "name": "Citizens Public Safety Review and Appeal Board",
    "category": "Public Safety & Civil Rights",